{
  "protocol": "mythos-control/1",
  "task_id": "gh-issue-499",
  "project": "mythos-prod",
  "objective": "Run the report-normalization test suite and report its result. Test suites in this repository live in tests/ and are named <suite>-test.js. Run exactly this command from the repository root, and no other command or file: node tests/mythos-report-normalization.js . Do not correct the path yourself. Put the command's first output line verbatim in the report tests list. If the command fails, report the task as failed and quote that line as the only problem. Change nothing.",
  "scope": [
    "tests/ (read and run only)"
  ],
  "constraints": [
    "Read-only: do not create, modify, delete, stage, commit or push anything.",
    "Do not print secrets or credentials.",
    "Supervised task: the MYTHOS supervisor verifies this report against the acceptance criteria below. Report exactly what you ran and observed; never claim a check you did not run."
  ],
  "priority": "normal",
  "requested_action": "test",
  "action_raw": "test",
  "action_source": "explicit_current_issue",
  "validation_requirements": [
    "The tests list contains the command's first output line verbatim.",
    "check:status_completed",
    "check:tests_pass"
  ],
  "status": "CLAIMED",
  "created_at": "2026-09-26T19:24:08.059Z",
  "created_by": "github-issue:othoth77",
  "timeout_seconds": 600,
  "model": "fable-5.1",
  "model_raw": "Fable 5.1",
  "model_source": "explicit_current_issue",
  "notes": "Source: GitHub Issue #499 https://github.com/othoth77/mythos-prod/issues/499 — \"[supervised] E2E-5 Qwen deadline: report-normalization suite path\"\n\nrequested_action: test — source explicit_current_issue (written as \"test\") → execution profile repo-test\n\nmodel: fable-5.1 — source explicit_current_issue (written as \"Fable 5.1\")",
  "source": {
    "kind": "github-issue",
    "repo": "othoth77/mythos-prod",
    "issue_number": 499,
    "issue_url": "https://github.com/othoth77/mythos-prod/issues/499",
    "issue_id": 5596659351,
    "issue_node_id": "I_kwDOTnlaF88AAAABTZY-lw",
    "issue_title": "TASK: [supervised] E2E-5 Qwen deadline: report-normalization suite path",
    "issue_author": "othoth77",
    "issue_created_at": "2026-09-26T19:23:36Z",
    "issue_updated_at": "2026-09-26T19:23:36Z",
    "issue_labels": [
      "task",
      "mythos:supervised"
    ],
    "content_sha256": "fc74d6442d9a78214ce3b4427a7d52d8ace843516cfb6ec8882b6eb1d303c4b4",
    "attempt": 1,
    "attempt_id": "gh-issue-499#1",
    "idempotency_key": "ec8c72cb9b71a0a20ea022ebaed47356db05a694dc91ac7d38bc16402f2da6ea",
    "rerun_of": null,
    "inherited_from": null,
    "inherited": {
      "requested_action": false,
      "model": false,
      "scope": false,
      "constraints": false,
      "validation_requirements": false
    },
    "resolution": {
      "requested_action": "test",
      "action_raw": "test",
      "action_source": "explicit_current_issue",
      "action_conflict": null,
      "action_candidates": [
        {
          "source": "explicit_current_issue",
          "raw": "test",
          "action": "test",
          "form": "inline",
          "line": 21
        },
        {
          "source": "default",
          "raw": "investigate",
          "action": "investigate",
          "form": null,
          "line": null
        }
      ],
      "execution_profile": "repo-test",
      "expected_delivery": "report",
      "model_key": "fable-5.1",
      "model_id": "claude-fable-5-1",
      "model_raw": "Fable 5.1",
      "model_source": "explicit_current_issue",
      "model_available": true,
      "model_reason": "explicit:fable-5.1 (requested \"Fable 5.1\" via explicit_current_issue)",
      "available_models": [
        "Haiku 4.5",
        "Sonnet 5",
        "Opus 5",
        "Fable 5",
        "Fable 5.1"
      ],
      "resolved_at": "2026-09-26T19:24:08.060Z",
      "resolved_by": "bridge/action-resolution.js"
    },
    "truncated": [],
    "events": [
      {
        "at": "2026-09-26T19:24:08.060Z",
        "event": "issue_received",
        "reason": "open Issue #499 with label task",
        "content_sha256": "fc74d6442d9a78214ce3b4427a7d52d8ace843516cfb6ec8882b6eb1d303c4b4"
      },
      {
        "at": "2026-09-26T19:24:08.060Z",
        "event": "action_resolved",
        "reason": "explicit_current_issue → test (raw \"test\")"
      },
      {
        "at": "2026-09-26T19:24:08.060Z",
        "event": "profile_resolved",
        "reason": "test → repo-test (server-side map)"
      },
      {
        "at": "2026-09-26T19:24:08.060Z",
        "event": "model_resolved",
        "reason": "explicit_current_issue → fable-5.1 (available)"
      },
      {
        "at": "2026-09-26T19:24:10.090Z",
        "event": "task_created",
        "reason": "control/tasks/gh-issue-499.json PENDING; created comment posted"
      }
    ],
    "converted_at": "2026-09-26T19:24:08.060Z",
    "converted_by": "github-issues",
    "notifications": {
      "created": {
        "comment_id": 5849153332,
        "url": "https://github.com/othoth77/mythos-prod/issues/499#issuecomment-5849153332",
        "at": "2026-09-26T19:24:08.778Z",
        "existed": false
      },
      "claimed": {
        "comment_id": 5849154434,
        "url": "https://github.com/othoth77/mythos-prod/issues/499#issuecomment-5849154434",
        "at": "2026-09-26T19:24:15.912Z",
        "existed": false,
        "executor_task_id": "t-20260926192412-b3g3e8"
      }
    },
    "labels": {
      "added": [
        "mythos:queued"
      ],
      "removed": [
        "mythos:supervised"
      ]
    }
  },
  "execution": {
    "executor_task_id": "t-20260926192412-b3g3e8",
    "othmode_task_id": "OTH-2026-01930",
    "attempt_id": "gh-issue-499#1",
    "requested_action": "test",
    "action_raw": "test",
    "action_source": "explicit_current_issue",
    "execution_profile": "repo-test",
    "expected_profile": "repo-test",
    "expected_delivery": "report",
    "model_key": "fable-5.1",
    "model_requested": "Fable 5.1",
    "model_source": "explicit_current_issue",
    "worktree": "/home/deploy/mythos-ai-executor/worktrees/gh/gh-issue-499",
    "branch": "mythos/gh/gh-issue-499",
    "base_commit": "fe315aeb395e58b3cb8bfbaeb759e81ff833af38",
    "claimed_at": "2026-09-26T19:24:12.174Z",
    "claimed_by": "github-bridge@vps-4722f0a9",
    "routing": {
      "routed": false,
      "provider": "claude-code",
      "why": "this bridge instance is not an execution worker; the configured provider is used unchanged"
    },
    "fingerprint": "537d887d0ecef934aafe7c8688b7e8ad2df3bbf6b02c860320b900828bc93506",
    "executor_status": "QUEUED",
    "updated_at": "2026-09-26T19:24:12.174Z",
    "snapshot_sha256": "167e53bee581a5cc8890a550d6be85ab4d89d1e0325366b015d7457857e0aab4",
    "fence": 77588,
    "lease": {
      "owner": "github-bridge@vps-4722f0a9:2307436",
      "fence": 77588,
      "acquired_at": "2026-09-26T19:24:12.174Z",
      "expires_at": "2026-09-26T20:04:12.174Z"
    },
    "runtime": {
      "module": "/home/deploy/projects/mythos-prod/projects/mythos-ai-executor/bridge/github-bridge.js",
      "checkout": "/home/deploy/projects/mythos-prod",
      "head": "b2487ee1a5ba6b22c834f3ba2f0ce49fed2732de",
      "branch": "main",
      "dirty_files": 1,
      "base_ref": "origin/main",
      "base_ref_head": "fe315aeb395e58b3cb8bfbaeb759e81ff833af38",
      "expected_head": null,
      "host": "vps-4722f0a9",
      "user": "deploy",
      "node": "v22.22.1",
      "verified": true,
      "stale": true,
      "code": "RUNTIME_STALE_CHECKOUT",
      "reason": "checkout HEAD b2487ee1a5ba is behind origin/main fe315aeb395e — the running bridge is older than what is delivered",
      "measured_at": "2026-09-26T19:24:10.782Z"
    },
    "model": "claude-fable-5-1",
    "model_selection_mode": "explicit"
  },
  "history": [
    {
      "at": "2026-09-26T19:24:12.272Z",
      "from": "PENDING",
      "to": "CLAIMED",
      "by": "github-bridge",
      "note": "executor task t-20260926192412-b3g3e8 queued; OTHMODE OTH-2026-01930; action test (explicit_current_issue) → repo-test; model claude-fable-5-1; fence 77588"
    }
  ]
}
