{
  "protocol": "mythos-control/1",
  "task_id": "gh-issue-125",
  "project": "mythos-prod",
  "objective": "إصلاح ملاحظة المراجعة الوحيدة المتبقية على PR #124: توثيق `fsync-backed rename` لا يطابق التنفيذ الفعلي في `writeEntry()`.",
  "scope": [
    "راجع `projects/mythos-ai-executor/bridge/notify/whatsapp.js` ومسار `writeEntry()` الحالي.",
    "إمّا:",
    "تنفيذ durable write حقيقي إذا كان ذلك ضروريًا ومناسبًا ضمن نطاق WhatsApp Bridge، باستخدام آلية موثوقة ومختبرة، ثم تحديث الاختبارات والتوثيق؛ أو",
    "إذا كان الضمان المقصود لا يحتاج `fsync` فعليًا، أزل/صحح أي ادعاء `fsync-backed` واجعل التوثيق يصف بدقة الضمان الحقيقي للكود.",
    "لا تغيّر ضمان delivery من at-least-once + best-effort deduplication إلى ادعاء أقوى دون دليل.",
    "أضف regression test مباشر يثبت السلوك الذي توثقه، بما في ذلك مسار الكتابة/الـcrash semantics إن كان متأثرًا.",
    "شغّل اختبارات WhatsApp notification + GitHub Bridge + Executor + Governance، وأي اختبارات مباشرة متأثرة.",
    "أنشئ commit نظيف على مسار PR #124، ولا تدمج إلى main.",
    "التقرير النهائي يجب أن يحتوي على `mythos_report` structured block، commit SHA، branch، base SHA، الملفات والاختبارات والنتيجة."
  ],
  "constraints": [
    "لا deploy لـ Evolution API.",
    "لا real WhatsApp message.",
    "لا AUTOS-0، SPY/n8n، MYTHOS AUTO/customer chat.",
    "لا Resource Guard thresholds ولا Model Policy.",
    "لا systemd/VPS changes.",
    "لا secrets.",
    "لا `git add .`.",
    "لا تعديل يدوي لـ `control/`.",
    "لا merge إلى main."
  ],
  "priority": "normal",
  "requested_action": "implement",
  "action_raw": "implement",
  "action_source": "explicit_current_issue",
  "validation_requirements": [],
  "status": "CLAIMED",
  "created_at": "2026-09-03T12:33:39.625Z",
  "created_by": "github-issue:othoth77",
  "model": "sonnet",
  "model_raw": "Sonnet",
  "model_source": "explicit_current_issue",
  "notes": "Source: GitHub Issue #125 https://github.com/othoth77/mythos-prod/issues/125 — \"إصلاح توثيق crash-safety في WhatsApp Bridge\"\n\nrequested_action: implement — source explicit_current_issue (written as \"implement\") → execution profile repo-write\n\nmodel: sonnet — source explicit_current_issue (written as \"Sonnet\")\n\n[النتيجة المطلوبة]\nإزالة عدم التطابق بين الكود والتوثيق، مع اختبار يثبت الضمان الفعلي، وإبقاء PR #124 جاهزًا للمراجعة النهائية.",
  "source": {
    "kind": "github-issue",
    "repo": "othoth77/mythos-prod",
    "issue_number": 125,
    "issue_url": "https://github.com/othoth77/mythos-prod/issues/125",
    "issue_id": 5336661721,
    "issue_node_id": "I_kwDOTnlaF88AAAABPhb-2Q",
    "issue_title": "TASK: إصلاح توثيق crash-safety في WhatsApp Bridge",
    "issue_author": "othoth77",
    "issue_created_at": "2026-09-03T12:32:58Z",
    "issue_updated_at": "2026-09-03T12:32:58Z",
    "issue_labels": [
      "task",
      "mythos:human-approval"
    ],
    "content_sha256": "c82c7fdcaaabd320e16bcc87b354f9c98209142dd4b25cf540286eabd373aaff",
    "attempt": 1,
    "attempt_id": "gh-issue-125#1",
    "idempotency_key": "b191a7a66a181551c4e052b48abb341f20b81ade57d8aa4fbcd3377bd74c708a",
    "rerun_of": null,
    "inherited_from": null,
    "inherited": {
      "requested_action": false,
      "model": false,
      "scope": false,
      "constraints": false,
      "validation_requirements": false
    },
    "resolution": {
      "requested_action": "implement",
      "action_raw": "implement",
      "action_source": "explicit_current_issue",
      "action_conflict": null,
      "action_candidates": [
        {
          "source": "explicit_current_issue",
          "raw": "implement",
          "action": "implement",
          "form": "heading_inline",
          "line": 1
        },
        {
          "source": "default",
          "raw": "investigate",
          "action": "investigate",
          "form": null,
          "line": null
        }
      ],
      "execution_profile": "repo-write",
      "expected_delivery": "commit",
      "model_key": "sonnet",
      "model_id": "claude-sonnet-5",
      "model_raw": "Sonnet",
      "model_source": "explicit_current_issue",
      "model_available": true,
      "model_reason": "explicit:sonnet (requested \"Sonnet\" via explicit_current_issue)",
      "available_models": [
        "Haiku 4.5",
        "Sonnet 5",
        "Opus 5",
        "Fable 5",
        "Fable 5.1"
      ],
      "resolved_at": "2026-09-03T12:33:39.626Z",
      "resolved_by": "bridge/action-resolution.js"
    },
    "truncated": [],
    "events": [
      {
        "at": "2026-09-03T12:33:39.626Z",
        "event": "issue_received",
        "reason": "open Issue #125 with label task",
        "content_sha256": "c82c7fdcaaabd320e16bcc87b354f9c98209142dd4b25cf540286eabd373aaff"
      },
      {
        "at": "2026-09-03T12:33:39.626Z",
        "event": "action_resolved",
        "reason": "explicit_current_issue → implement (raw \"implement\")"
      },
      {
        "at": "2026-09-03T12:33:39.626Z",
        "event": "profile_resolved",
        "reason": "implement → repo-write (server-side map)"
      },
      {
        "at": "2026-09-03T12:33:39.626Z",
        "event": "model_resolved",
        "reason": "explicit_current_issue → sonnet (available)"
      },
      {
        "at": "2026-09-03T12:33:42.066Z",
        "event": "task_created",
        "reason": "control/tasks/gh-issue-125.json PENDING; created comment posted"
      }
    ],
    "converted_at": "2026-09-03T12:33:39.626Z",
    "converted_by": "github-issues",
    "notifications": {
      "created": {
        "comment_id": 5525817531,
        "url": "https://github.com/othoth77/mythos-prod/issues/125#issuecomment-5525817531",
        "at": "2026-09-03T12:33:40.657Z",
        "existed": false
      },
      "claimed": {
        "comment_id": 5525818683,
        "url": "https://github.com/othoth77/mythos-prod/issues/125#issuecomment-5525818683",
        "at": "2026-09-03T12:33:46.847Z",
        "existed": false,
        "executor_task_id": "t-20260903123345-yjzccr"
      }
    },
    "labels": {
      "added": [
        "mythos:queued"
      ],
      "removed": [
        "mythos:human-approval"
      ]
    }
  },
  "execution": {
    "executor_task_id": "t-20260903123345-yjzccr",
    "othmode_task_id": "OTH-2026-00056",
    "attempt_id": "gh-issue-125#1",
    "requested_action": "implement",
    "action_raw": "implement",
    "action_source": "explicit_current_issue",
    "execution_profile": "repo-write",
    "expected_profile": "repo-write",
    "expected_delivery": "commit",
    "model_key": "sonnet",
    "model_requested": "Sonnet",
    "model_source": "explicit_current_issue",
    "worktree": "/home/deploy/mythos-ai-executor/worktrees/gh/gh-issue-125",
    "branch": "mythos/gh/gh-issue-125",
    "base_commit": "d69e0abc34decc37ba4a6fba680ba80f5bf6bff1",
    "claimed_at": "2026-09-03T12:33:45.325Z",
    "claimed_by": "github-bridge@vps-4722f0a9",
    "fingerprint": "beaa4f124fe093635c670d57cc3fc2505596ad88540a0e6bf7c28fbfebe65911",
    "executor_status": "QUEUED",
    "updated_at": "2026-09-03T12:33:45.325Z",
    "snapshot_sha256": "b5e7ba5dae3d8d30a5021a7c494fc7a44a61c64579521312afceacc5d61db9be",
    "fence": 275,
    "lease": {
      "owner": "github-bridge@vps-4722f0a9:50789",
      "fence": 275,
      "acquired_at": "2026-09-03T12:33:45.325Z",
      "expires_at": "2026-09-03T14:03:45.325Z"
    },
    "runtime": {
      "module": "/home/deploy/projects/mythos-prod/projects/mythos-ai-executor/bridge/github-bridge.js",
      "checkout": "/home/deploy/projects/mythos-prod",
      "head": "d69e0abc34decc37ba4a6fba680ba80f5bf6bff1",
      "branch": "main",
      "dirty_files": 0,
      "base_ref": "origin/main",
      "base_ref_head": "d69e0abc34decc37ba4a6fba680ba80f5bf6bff1",
      "expected_head": null,
      "host": "vps-4722f0a9",
      "user": "deploy",
      "node": "v22.22.1",
      "verified": true,
      "stale": false,
      "code": null,
      "reason": null,
      "measured_at": "2026-09-03T12:33:43.578Z"
    },
    "model": "claude-sonnet-5",
    "model_selection_mode": "explicit"
  },
  "history": [
    {
      "at": "2026-09-03T12:33:45.357Z",
      "from": "PENDING",
      "to": "CLAIMED",
      "by": "github-bridge",
      "note": "executor task t-20260903123345-yjzccr queued; OTHMODE OTH-2026-00056; action implement (explicit_current_issue) → repo-write; model claude-sonnet-5; fence 275"
    }
  ]
}
